{
 "NotebookModel": "LENOVO 20W000Q4GE",
 "Author": "lutzseba",
 "EcPollInterval": 3000,
 "ReadWriteWords": false,
 "CriticalTemperature": 97,
 "FanConfigurations": [
	{
	 "ReadRegister": 47,
	 "WriteRegister": 47,
	 "MinSpeedValue": 0,
	 "MaxSpeedValue": 7,
	 "IndependentReadMinMaxValues": false,
	 "MinSpeedValueRead": 0,
	 "MaxSpeedValueRead": 0,
	 "ResetRequired": true,
	 "FanSpeedResetValue": 128,
	 "FanDisplayName": "System Fan",
	 "TemperatureThresholds": [
	  {
	   "UpThreshold": 65,
	   "DownThreshold": 0,
	   "FanSpeed": 0.0
	  },
	  {
	   "UpThreshold": 70,
	   "DownThreshold": 55,
	   "FanSpeed": 20.1970444
	  },
	  {
	   "UpThreshold": 75,
	   "DownThreshold": 60,
	   "FanSpeed": 40.0
	  },
	  {
	   "UpThreshold": 80,
	   "DownThreshold": 65,
	   "FanSpeed": 60.0000038
	  },
	  {
	   "UpThreshold": 85,
	   "DownThreshold": 72,
	   "FanSpeed": 80.0
	  },
	  {
	   "UpThreshold": 97,
	   "DownThreshold": 78,
	   "FanSpeed": 100.0
	  }
	 ],
	 "FanSpeedPercentageOverrides": []
	}
 ],
 "RegisterWriteConfigurations": []
}

