{
    "NotebookModel": "Acer Nitro AN515-44",
    "Author": "Mateus Honorato",
    "EcPollInterval": 3000,
    "ReadWriteWords": true,
    "CriticalTemperature": 90,
    "FanConfigurations": [
        {
            "ReadRegister": 19,
            "WriteRegister": 55,
            "MinSpeedValue": 0,
            "MaxSpeedValue": 100,
            "IndependentReadMinMaxValues": true,
            "MinSpeedValueRead": 0,
            "MaxSpeedValueRead": 6122,
            "ResetRequired": true,
            "FanSpeedResetValue": 0,
            "FanDisplayName": "Ryzen 4600H",
            "TemperatureThresholds": [
                {
                    "UpThreshold": 40,
                    "DownThreshold": 0,
                    "FanSpeed": 0
                },
                {
                    "UpThreshold": 42,
                    "DownThreshold": 40,
                    "FanSpeed": 30
                },
                {
                    "UpThreshold": 44,
                    "DownThreshold": 41,
                    "FanSpeed": 32
                },
                {
                    "UpThreshold": 48,
                    "DownThreshold": 43,
                    "FanSpeed": 34
                },
                {
                    "UpThreshold": 52,
                    "DownThreshold": 46,
                    "FanSpeed": 36
                },
                {
                    "UpThreshold": 54,
                    "DownThreshold": 50,
                    "FanSpeed": 38
                },
                {
                    "UpThreshold": 58,
                    "DownThreshold": 53,
                    "FanSpeed": 41
                },
                {
                    "UpThreshold": 62,
                    "DownThreshold": 56,
                    "FanSpeed": 44
                },
                {
                    "UpThreshold": 64,
                    "DownThreshold": 60,
                    "FanSpeed": 47
                },
                {
                    "UpThreshold": 68,
                    "DownThreshold": 63,
                    "FanSpeed": 50
                },
                {
                    "UpThreshold": 72,
                    "DownThreshold": 66,
                    "FanSpeed": 55
                },
                {
                    "UpThreshold": 74,
                    "DownThreshold": 70,
                    "FanSpeed": 61
                },
                {
                    "UpThreshold": 78,
                    "DownThreshold": 73,
                    "FanSpeed": 68
                },
                {
                    "UpThreshold": 82,
                    "DownThreshold": 76,
                    "FanSpeed": 76
                },
                {
                    "UpThreshold": 84,
                    "DownThreshold": 80,
                    "FanSpeed": 85
                },
                {
                    "UpThreshold": 88,
                    "DownThreshold": 83,
                    "FanSpeed": 94
                },
                {
                    "UpThreshold": 90,
                    "DownThreshold": 86,
                    "FanSpeed": 100
                }
            ],
            "FanSpeedPercentageOverrides": []
        },
        {
            "ReadRegister": 21,
            "WriteRegister": 58,
            "MinSpeedValue": 0,
            "MaxSpeedValue": 100,
            "IndependentReadMinMaxValues": true,
            "MinSpeedValueRead": 0,
            "MaxSpeedValueRead": 6122,
            "ResetRequired": true,
            "FanSpeedResetValue": 0,
            "FanDisplayName": "NVIDIA GeForce GTX 1650",
            "TemperatureThresholds": [
                {
                    "UpThreshold": 40,
                    "DownThreshold": 0,
                    "FanSpeed": 0
                },
                {
                    "UpThreshold": 42,
                    "DownThreshold": 40,
                    "FanSpeed": 30
                },
                {
                    "UpThreshold": 44,
                    "DownThreshold": 41,
                    "FanSpeed": 32
                },
                {
                    "UpThreshold": 48,
                    "DownThreshold": 43,
                    "FanSpeed": 34
                },
                {
                    "UpThreshold": 52,
                    "DownThreshold": 46,
                    "FanSpeed": 36
                },
                {
                    "UpThreshold": 54,
                    "DownThreshold": 50,
                    "FanSpeed": 38
                },
                {
                    "UpThreshold": 58,
                    "DownThreshold": 53,
                    "FanSpeed": 41
                },
                {
                    "UpThreshold": 62,
                    "DownThreshold": 56,
                    "FanSpeed": 44
                },
                {
                    "UpThreshold": 64,
                    "DownThreshold": 60,
                    "FanSpeed": 47
                },
                {
                    "UpThreshold": 68,
                    "DownThreshold": 63,
                    "FanSpeed": 50
                },
                {
                    "UpThreshold": 72,
                    "DownThreshold": 66,
                    "FanSpeed": 55
                },
                {
                    "UpThreshold": 74,
                    "DownThreshold": 70,
                    "FanSpeed": 61
                },
                {
                    "UpThreshold": 78,
                    "DownThreshold": 73,
                    "FanSpeed": 68
                },
                {
                    "UpThreshold": 82,
                    "DownThreshold": 76,
                    "FanSpeed": 76
                },
                {
                    "UpThreshold": 84,
                    "DownThreshold": 80,
                    "FanSpeed": 85
                },
                {
                    "UpThreshold": 88,
                    "DownThreshold": 83,
                    "FanSpeed": 94
                },
                {
                    "UpThreshold": 90,
                    "DownThreshold": 86,
                    "FanSpeed": 100
                }
            ],
            "FanSpeedPercentageOverrides": []
        }
    ],
    "RegisterWriteConfigurations": [
        {
            "WriteMode": "Set",
            "WriteOccasion": "OnInitialization",
            "Register": 34,
            "Value": 12,
            "ResetRequired": true,
            "ResetValue": 4,
            "ResetWriteMode": "Set",
            "Description": "CPU fan manual mode"
        },
        {
            "WriteMode": "Set",
            "WriteOccasion": "OnInitialization",
            "Register": 33,
            "Value": 48,
            "ResetRequired": true,
            "ResetValue": 16,
            "ResetWriteMode": "Set",
            "Description": "GPU fan manual mode"
        },
        {
            "WriteMode": "Set",
            "WriteOccasion": "OnInitialization",
            "Register": 16,
            "Value": 0,
            "ResetRequired": true,
            "ResetValue": 1,
            "ResetWriteMode": "Set",
            "Description": "CoolBoost off"
        }
    ]
}